### ISSUE TITLE
compose: Client-side keepalive doesn't work

### ISSUE THREAD

**Issue by bam80** [9seconds/mtg#534]
Скажите, кто-нибудь проверял что [это](https://github.com/9seconds/mtg/pull/441) реально работает?

Я так и не смог отсеять keepalive пакеты tcpdump'ом на системе с mtg:
`tcpdump -vv -i phy0-sta0 "dst host <client public IP>`

Обычно прокси часто подсыпает пакетами, но когда телефон засыпает, это резко прекращается, хотя соединение похоже не рвется, т.к. при входящих событиях пакеты появляются.

Так вот, если эта фича работает, я ожидаю видеть как минимум 1 keepalive пакет раз в 30 секунд, если других пакетов нет.
Но этого похоже не происходит - если наблюдать за трафиком, периодически возникает "тишина", которая может достигать нескольких минут и никак не связана с 30 секундами.
Обычно она нарушается очередным блоком пакетов, а не единичным keepalive.

Я кстати не знаю как сказать tcpdump'у показывать только keepalive пакеты, поэтому смотрю всё вместе, но всё равно - такое ощущение что keepalive просто не работает.

Было бы полезно если кто-то ещё проведёт этот эксперимент, спасибо.

_Originally posted by @bam80 in https://github.com/9seconds/mtg/issues/441#issuecomment-4525552900_

UPDATE:
_Объяснение этому феномену дано [ниже](https://github.com/9seconds/mtg/issues/534#issuecomment-4579696098).
Проблема специфична для compose, но от того не менее актуальна._

@dolonet

**Comment by bam80** [comment]
Для сравнения, в другом Go проекте человек сразу мог видеть keepalive пакеты Wireshark'ом:

<img width="920" height="471" alt="Image" src="https://github.com/user-attachments/assets/b4fce272-9f53-486f-8a44-eda5158d5589" />

https://github.com/gotify/server/issues/343

**Comment by dolonet** [comment]
Ваш `ss -to` крутился на хосте, а mtg сидит в подмане в своём netns — исходящие к DC оттуда не видны. То что вы всё-таки увидели две `127.0.0.1`-записи с `timer:(keepalive, …)` — как раз и есть доказательство, что keepalive армирован: это таймер обратного отсчёта до следующей пробы, выставленный ядром после `setsockopt(SO_KEEPALIVE, TCP_KEEPIDLE=30, TCP_KEEPINTVL=10, TCP_KEEPCNT=3)` (см. `network/sockopts_test.go`, который читает эти опции `getsockopt`'ом).

Чтобы увидеть DC-сокеты:
```
podman exec sni-router_mtg_1 ss -tneoi
```
Если в образе нет `ss`, с хоста: `nsenter -t $(podman inspect -f '{{.State.Pid}}' sni-router_mtg_1) -n ss -tneoi`. Там же увидите `timer:(keepalive, …)` на исходящих к DC.

Если у конкретного соединения трафик идёт постоянно (Telegram активен) — `TCP_KEEPIDLE` это "время с последнего пакета", не настенный интервал, так что проба не сработает; искусственно простаивающее соединение (`nc <ip> <port>`, ничего не слать) даёт чистую картинку.

**Comment by bam80** [comment]
Спасибо, nsenter помог, значения правда всегда разные, максимум что мне удалось увидеть это 27 сек, но это в общем то бьется с тем что вы написали:
```console
# nsenter -t $(podman inspect -f '{{.State.Pid}}' sni-router_mtg_1) -n ss -to
State               Recv-Q               Send-Q                                  Local Address:Port                                    Peer Address:Port                                                           
ESTAB               0                    0                                           10.89.0.2:60606                                      10.89.0.1:9050                timer:(keepalive,1.160sec,0)               
ESTAB               0                    0                                  [::ffff:10.89.0.2]:3128                              [::ffff:10.89.0.1]:49068               timer:(keepalive,400ms,0)                  
root@RPi:~# nsenter -t $(podman inspect -f '{{.State.Pid}}' sni-router_mtg_1) -n ss -to
State                       Recv-Q                       Send-Q                                             Local Address:Port                                             Peer Address:Port                       
root@RPi:~# nsenter -t $(podman inspect -f '{{.State.Pid}}' sni-router_mtg_1) -n ss -to
State                       Recv-Q                       Send-Q                                             Local Address:Port                                             Peer Address:Port                       
root@RPi:~# nsenter -t $(podman inspect -f '{{.State.Pid}}' sni-router_mtg_1) -n ss -to
State               Recv-Q               Send-Q                                  Local Address:Port                                      Peer Address:Port                                                         
ESTAB               0                    0                                           10.89.0.2:53246                                        10.89.0.1:9050                 timer:(keepalive,12sec,0)               
ESTAB               0                    0                                  [::ffff:10.89.0.2]:3128                                [::ffff:10.89.0.1]:35082                timer:(keepalive,27sec,0)               
root@RPi:~# nsenter -t $(podman inspect -f '{{.State.Pid}}' sni-router_mtg_1) -n ss -to
State               Recv-Q               Send-Q                                  Local Address:Port                                    Peer Address:Port                                                           
ESTAB               0                    0                                           10.89.0.2:53246                                      10.89.0.1:9050                timer:(keepalive,6.070sec,0)               
ESTAB               0                    0                                  [::ffff:10.89.0.2]:3128                              [::ffff:10.89.0.1]:35082               timer:(keepalive,21sec,0)                  
root@RPi:~# nsenter -t $(podman inspect -f '{{.State.Pid}}' sni-router_mtg_1) -n ss -to
State               Recv-Q               Send-Q                                  Local Address:Port                                    Peer Address:Port                                                           
ESTAB               0                    0                                           10.89.0.2:53246                                      10.89.0.1:9050                timer:(keepalive,2.830sec,0)               
ESTAB               0                    0                                  [::ffff:10.89.0.2]:3128                              [::ffff:10.89.0.1]:35082               timer:(keepalive,17sec,0)                  
root@RPi:~# nsenter -t $(podman inspect -f '{{.State.Pid}}' sni-router_mtg_1) -n ss -to
State               Recv-Q               Send-Q                                  Local Address:Port                                    Peer Address:Port                                                           
ESTAB               0                    0                                           10.89.0.2:53246                                      10.89.0.1:9050                timer:(keepalive,9.660sec,0)               
ESTAB               0                    0                                  [::ffff:10.89.0.2]:3128                              [::ffff:10.89.0.1]:35082               timer:(keepalive,8.870sec,0)               
root@RPi:~# nsenter -t $(podman inspect -f '{{.State.Pid}}' sni-router_mtg_1) -n ss -to
State               Recv-Q               Send-Q                                  Local Address:Port                                    Peer Address:Port                                                           
ESTAB               0                    0                                           10.89.0.2:53246                                      10.89.0.1:9050                timer:(keepalive,6.860sec,0)               
ESTAB               0                    0                                  [::ffff:10.89.0.2]:3128                              [::ffff:10.89.0.1]:35082               timer:(keepalive,6.070sec,0)               
root@RPi:~# nsenter -t $(podman inspect -f '{{.State.Pid}}' sni-router_mtg_1) -n ss -to
State               Recv-Q               Send-Q                                  Local Address:Port                                    Peer Address:Port                                                           
ESTAB               0                    0                                           10.89.0.2:53246                                      10.89.0.1:9050                timer:(keepalive,5.200sec,0)               
ESTAB               0                    0                                  [::ffff:10.89.0.2]:3128                              [::ffff:10.89.0.1]:35082               timer:(keepalive,4.410sec,0)               
root@RPi:~# nsenter -t $(podman inspect -f '{{.State.Pid}}' sni-router_mtg_1) -n ss -to
State               Recv-Q               Send-Q                                  Local Address:Port                                    Peer Address:Port                                                           
ESTAB               0                    0                                           10.89.0.2:53246                                      10.89.0.1:9050                timer:(keepalive,3.300sec,0)               
ESTAB               0                    0                                  [::ffff:10.89.0.2]:3128                              [::ffff:10.89.0.1]:35082               timer:(keepalive,2.510sec,0)               
root@RPi:~# nsenter -t $(podman inspect -f '{{.State.Pid}}' sni-router_mtg_1) -n ss -to
State               Recv-Q               Send-Q                                  Local Address:Port                                    Peer Address:Port                                                           
ESTAB               0                    0                                           10.89.0.2:53246                                      10.89.0.1:9050                timer:(keepalive,1.980sec,0)               
ESTAB               0                    0                                  [::ffff:10.89.0.2]:3128                              [::ffff:10.89.0.1]:35082               timer:(keepalive,1.190sec,0)               
root@RPi:~# nsenter -t $(podman inspect -f '{{.State.Pid}}' sni-router_mtg_1) -n ss -to
State               Recv-Q               Send-Q                                  Local Address:Port                                      Peer Address:Port                                                         
ESTAB               0                    0                                           10.89.0.2:53246                                        10.89.0.1:9050                 timer:(keepalive,590ms,0)               
ESTAB               0                    0                                  [::ffff:10.89.0.2]:3128                                [::ffff:10.89.0.1]:35082                timer:(keepalive,,0)                    
root@RPi:~# nsenter -t $(podman inspect -f '{{.State.Pid}}' sni-router_mtg_1) -n ss -to
State               Recv-Q               Send-Q                                  Local Address:Port                                      Peer Address:Port                                                         
ESTAB               0                    0                                           10.89.0.2:53246                                        10.89.0.1:9050                 timer:(keepalive,13sec,0)               
ESTAB               0                    0                                  [::ffff:10.89.0.2]:3128                                [::ffff:10.89.0.1]:35082                timer:(keepalive,8.690sec,0)            
root@RPi:~# nsenter -t $(podman inspect -f '{{.State.Pid}}' sni-router_mtg_1) -n ss -to
State               Recv-Q               Send-Q                                  Local Address:Port                                      Peer Address:Port                                                         
ESTAB               0                    0                                           10.89.0.2:53246                                        10.89.0.1:9050                 timer:(keepalive,11sec,0)               
ESTAB               0                    0                                  [::ffff:10.89.0.2]:3128                                [::ffff:10.89.0.1]:35082                timer:(keepalive,5.870sec,0)            
root@RPi:~# nsenter -t $(podman inspect -f '{{.State.Pid}}' sni-router_mtg_1) -n ss -to
State               Recv-Q               Send-Q                                  Local Address:Port                                    Peer Address:Port                                                           
ESTAB               0                    0                                           10.89.0.2:53246                                      10.89.0.1:9050                timer:(keepalive,9.160sec,0)               
ESTAB               0                    0                                  [::ffff:10.89.0.2]:3128                              [::ffff:10.89.0.1]:35082               timer:(keepalive,3.920sec,0)               
root@RPi:~# nsenter -t $(podman inspect -f '{{.State.Pid}}' sni-router_mtg_1) -n ss -to
State               Recv-Q               Send-Q                                  Local Address:Port                                    Peer Address:Port                                                           
ESTAB               0                    0                                           10.89.0.2:53246                                      10.89.0.1:9050                timer:(keepalive,7.180sec,0)               
ESTAB               0                    0                                  [::ffff:10.89.0.2]:3128                              [::ffff:10.89.0.1]:35082               timer:(keepalive,1.950sec,0)               
root@RPi:~# nsenter -t $(podman inspect -f '{{.State.Pid}}' sni-router_mtg_1) -n ss -to
State               Recv-Q               Send-Q                                  Local Address:Port                                    Peer Address:Port                                                           
ESTAB               0                    0                                           10.89.0.2:53246                                      10.89.0.1:9050                timer:(keepalive,5.020sec,0)               
ESTAB               0                    0                                  [::ffff:10.89.0.2]:3128                              [::ffff:10.89.0.1]:35082               timer:(keepalive,,0)                       
root@RPi:~# nsenter -t $(podman inspect -f '{{.State.Pid}}' sni-router_mtg_1) -n ss -to
State               Recv-Q               Send-Q                                  Local Address:Port                                    Peer Address:Port                                                           
ESTAB               0                    0                                           10.89.0.2:53246                                      10.89.0.1:9050                timer:(keepalive,3.380sec,0)               
ESTAB               0                    0                                  [::ffff:10.89.0.2]:3128                              [::ffff:10.89.0.1]:35082               timer:(keepalive,18sec,0)
```
Теперь попробую поймать сами эти пакеты.

**Comment by bam80** [comment]
Keepalive пакеты пока зарегистрировать не удалось.
Подозреваю, что может быть они и отсылаются внутри контейнера, но наружу не выходят. Хотя странно.

Процедура:
2 терминала к серверу, в одном запускаем tcpdump, в другом nc (в таком порядке):
```console
root@RPi:~# nc localhost 8443 
# ... waiting 1 min
root@RPi:~#
``` 
```console
root@RPi:~# tcpdump -vv -i lo  "port 8443"
tcpdump: listening on lo, link-type EN10MB (Ethernet), snapshot length 262144 bytes

# сразу после nc
01:35:13.854646 IP6 (flowlabel 0xf8ffc, hlim 64, next-header TCP (6), payload length 40) localhost.52912 > localhost.8443: Flags [S], cksum 0x0030 (incorrect -> 0x9e7a), seq 118201166, win 65476, options [mss 65476,sackOK,TS val 1342950813 ecr 0,nop,wscale 7], length 0
01:35:13.854758 IP6 (flowlabel 0x091a7, hlim 64, next-header TCP (6), payload length 40) localhost.8443 > localhost.52912: Flags [S.], cksum 0x0030 (incorrect -> 0x42c5), seq 1315172258, ack 118201167, win 65464, options [mss 65476,sackOK,TS val 1342950814 ecr 1342950813,nop,wscale 7], length 0
01:35:13.854827 IP6 (flowlabel 0xf8ffc, hlim 64, next-header TCP (6), payload length 32) localhost.52912 > localhost.8443: Flags [.], cksum 0x0028 (incorrect -> 0x695a), seq 1, ack 1, win 512, options [nop,nop,TS val 1342950814 ecr 1342950814], length 0

# ... waiting 1 min

01:36:13.872309 IP6 (flowlabel 0x091a7, hlim 64, next-header TCP (6), payload length 32) localhost.8443 > localhost.52912: Flags [F.], cksum 0x0028 (incorrect -> 0x7ee7), seq 1, ack 1, win 512, options [nop,nop,TS val 1343010831 ecr 1342950814], length 0
01:36:13.872749 IP6 (flowlabel 0xf8ffc, hlim 64, next-header TCP (6), payload length 32) localhost.52912 > localhost.8443: Flags [F.], cksum 0x0028 (incorrect -> 0x9473), seq 1, ack 2, win 512, options [nop,nop,TS val 1343010832 ecr 1343010831], length 0
01:36:13.872816 IP6 (flowlabel 0x091a7, hlim 64, next-header TCP (6), payload length 32) localhost.8443 > localhost.52912: Flags [.], cksum 0x0028 (incorrect -> 0x9472), seq 2, ack 2, win 512, options [nop,nop,TS val 1343010832 ecr 1343010832], length 0

# nc вышел
```
tcpdump выдал первые 3 пакета сразу после запуска nc, возможно это "3х сторонний хендшейк" или что-то в этом духе.
Делее, через минуту ещё 3 пакета, и nc завершился. Видимо, это были пакеты, рвущие соединение.

Таким образом, среди этого keepalive пакетов и вообще пакетов через 30 сек и после я не вижу.

**Comment by dolonet** [comment]
Давайте разложу по полочкам, потому что заголовок «keepalive не работает» ваши же измерения опровергают.

**Keepalive армирован.** В вашем выводе `ss -to` оба сокета mtg показывают `timer:(keepalive, …)` с обратным отсчётом — и `:3128` (нога HAProxy → mtg), и исходящий на `10.89.0.1:9050` (нога mtg → апстрим). Сам факт таймера означает, что `SO_KEEPALIVE` на сокете включён.

Конкретно клиентскую ногу `:3128` тюнит код из #441: для входящих (client-facing) соединений mtg выставляет `TCP_KEEPIDLE=30`, `TCP_KEEPINTVL=10`, `TCP_KEEPCNT=3` (см. `network/init.go` и проверку через `getsockopt` в `network/sockopts_test.go`). То, что на `:3128` вы ловили обратный отсчёт максимум до ~27 с, ровно с этим idle=30 и бьётся. Значит фича на месте.

(Маленькая оговорка про исходящую ногу на `:9050`: keepalive там тоже есть, но это апстрим-сокет к вашему SOCKS, и идёт он через обычный `net.Dialer` — поэтому на нём не 30/10/3, а дефолты Go, idle ≈15 с. С этим и бьются отсчёты до ~13 с, что вы на ней видели. Для исходного вопроса это не важно: вопрос про keepalive в сторону клиента, и эта нога — `:3128`.)

**Почему в сторону телефона проб нет — и не может быть.** В топологии sni-router (`contrib/sni-router/docker-compose.yml`) путь такой: `телефон → HAProxy:443 → mtg:3128`. TCP-соединение от телефона терминирует HAProxy, а не mtg. Keepalive mtg действует только на сокеты, которыми владеет сам mtg — это нога HAProxy → mtg и исходящая нога к апстриму. На соединении `телефон ↔ сервер` keepalive — это уже зона ответственности HAProxy (его `timeout client` / `option clitcpka`), не mtg. Поэтому `tcpdump … dst host <client public IP>` в принципе всегда будет пустым по части mtg-проб: mtg по дизайну не шлёт keepalive на публичный IP телефона.

**Почему пробу не удалось поймать даже внутри netns.** `TCP_KEEPIDLE` отсчитывает время с момента *последнего сегмента* на соединении, а не настенные 30 с. Ваша нога ни разу не простаивала полные 30 с — максимум вы видели ~27 с, после чего таймер сбрасывался очередным пакетом. Раз idle не дотягивает до порога, проба не взводится. Чтобы её увидеть: возьмите реально установленную (`ESTAB`) клиентскую ногу `:3128`, обеспечьте на ней ноль трафика дольше 30 с и снимайте дамп **внутри netns**, а не на хосте.

**Про эксперимент с `nc` на `localhost 8443`.** Тут ловить нечего, и не из-за keepalive:

- В этом compose на `8443` слушает Caddy (веб-бэкенд), а mtg — на `3128`. Ваш `tcpdump -i lo port 8443` вообще не попадает на mtg.
- Idle-`nc` не проходит FakeTLS-хендшейк, поэтому соединение никогда не доходит до релейного состояния, где keepalive вообще релевантен.
- FIN через ~60 с — это тоже **не** mtg: и не его 10-секундный handshake-таймаут (mtg здесь вообще ни при чём, он на `:3128`), а закрытие по какому-то таймауту со стороны того сервиса, что слушает `:8443` (в стоковом compose — Caddy). Точный механизм/значение тут не важны — к keepalive и к mtg это отношения не имеет.

Если суммировать: на стороне mtg всё работает как задумано, а отсутствие проб к телефону — следствие того, что этот сокет принадлежит HAProxy.

Запрос «сделать дефолты конфигурируемыми» — это #526 (ответил там по существу); добавлять ли такую настройку, это отдельное продуктовое решение за мейнтейнером.

**Comment by bam80** [comment]
> В топологии sni-router (`contrib/sni-router/docker-compose.yml`) путь такой: `телефон → HAProxy:443 → mtg:3128`. TCP-соединение от телефона терминирует HAProxy, а не mtg.

Спасибо за объяснение, но ведь тогда получается, что в compose функционал регуляции keepalive в сторону клиента со стороны mtg работать не может, и все те негативные последствия, из-за чего этот функционал создавался, здесь вернутся.
Можем ли мы сделать что-то подобное для HAProxy, преследую ту же цель - чтобы соединение на NAT не рвалось и т.д.? Иначе смысл всех тех усилий для mtg не велик, мне кажется.

> * В этом compose на `8443` слушает Caddy (веб-бэкенд), а mtg — на `3128`. Ваш `tcpdump -i lo port 8443` вообще не попадает на mtg.

Я несколько изменил маппинг портов, 8443 это HAProxy в моём случае, но смысл я полагаю тот же - трафик ведь напрямую от клиента к mtg, минуя HAProxy, всё равно не идёт? Т.е. если я правильно понял, входящее TCP соединение заканчивается на HAProxy, там оно заново пересоздается уже  в сторону mtg, при этом параметры keepalive везде свои.

**Comment by dolonet** [comment]
Right — in the sni-router setup the phone's TCP terminates at HAProxy:443, so any keepalive mtg sets never reaches the phone. To keep the client's NAT mapping alive, set it on HAProxy's client-facing socket: `option clitcpka` (HAProxy ≥2.3 also takes `clitcpka-idle`/`clitcpka-intvl`/`clitcpka-cnt` for exact timing — those per-proxy keepalive tunables landed in 2.3; plain `option clitcpka` works on far older versions too. `timeout client` is currently 60s in `contrib/sni-router/haproxy.cfg`). That's a contrib config addition, not an mtg change — happy to PR a sample `clitcpka` line into `haproxy.cfg` if useful.

**Comment by bam80** [comment]
Спасибо за подтверждение, но я бы предпочел избавиться от 3-го сервиса (HAProxy?) вообще.
Сможем ли мы достичь того же с keepalive в Caddy?
