### ISSUE TITLE
Сильное потребление ЦПУ и много time-wait сам на себя - High CPU consumption and a lot of time-wait on itself

### ISSUE THREAD

**Issue by Shaverdoff** [9seconds/mtg#507]
Два дня назад заметил странное поведение сервера. Захожу, смотрю - mtg поедает 90% CPU и висит 7к tcp time-wait сессий, от себя на себя же. Из-за этого сам прокси становится не доступным. Версия последняя 2.2.8. После ребута сервера или выключения mtg  более менее восстанавливается. Проксей пользуются три человека, никому секреты не выдавал. Как быть? где-то баг зарыт?

tcp   TIME-WAIT 0      0      [::ffff:xx.xx.172.28]:443   [::ffff:xx.xx.172.28]:59490                                                                
tcp   TIME-WAIT 0      0      [::ffff:xx.xx.172.28]:443   [::ffff:xx.xx.172.28]:38588                                                                
tcp   TIME-WAIT 0      0      [::ffff:xx.xx.172.28]:443   [::ffff:xx.xx.172.28]:41496    
.... 
sudo ss -plunta | grep -i "28]:443" | grep -i TIME-WAIT -c
7823

ту инглиш

Two days ago, I noticed some strange server behavior. I logged in and saw that MTG was using 90% of the CPU and had 7,000 TCP time-wait sessions, both from itself and from itself. This made the server and proxy unavailable. The latest version installaed on server is 2.2.8. After rebooting the server or shutting down systemd unit of MTG server was recovers connections. Only three people are using the proxy, and it hasn't given out any secrets to anyone. What should I do? Is there a bug buried somewhere?

**Comment by DenLs8** [comment]
I have a similar issue. I tried rolling back to version 2.2.7, and the same thing happened.

**Comment by Shaverdoff** [comment]
i am tried telemt as diff mtproxy, and get the same issues… i guess this is behavior from dc to all proxy … need to wait some timesОтправлено с iPhone13 мая 2026 г., в 23:20, DenLs8 ***@***.***> написал(а):﻿DenLs8 left a comment (9seconds/mtg#507)
I have a similar issue. I tried rolling back to version 2.2.7, and the same thing happened.

**Comment by ElkyBoy** [comment]
@Shaverdoff I'm using Telemt right now and there are no problems with CPU load.

**Comment by Shaverdoff** [comment]
damn..... misclick
how many time_wait connections on you telemt instance?
i have one core, instance very light only for few people.

**Comment by ElkyBoy** [comment]
> damn..... misclick how many time_wait connections on you telemt instance? i have one core, instance very light only for few people.

From 19 to 9 time_wait connections for now. I have 1 core too, 2GB RAM. My MTProxy is currently being used by about 20 people.

**Comment by Shaverdoff** [comment]
> > damn..... misclick how many time_wait connections on you telemt instance? i have one core, instance very light only for few people.
> 
> From 19 to 9 time_wait connections for now. I have 1 core too, 2GB RAM. My MTProxy is currently being used by about 20 people.

very strage beh.... will see a little time spent... node-exporter help me for mon-observ that

**Comment by Shaverdoff** [comment]
<img width="833" height="197" alt="Image" src="https://github.com/user-attachments/assets/18ec5b0e-b33a-4578-9055-5b85f97bb35f" />

<img width="490" height="49" alt="Image" src="https://github.com/user-attachments/assets/765e2805-3486-49e9-9bff-57c2663108ca" />

again... 

<img width="1280" height="560" alt="Image" src="https://github.com/user-attachments/assets/ad91f3d3-538b-428e-bc3c-70876bff05c3" />

**Comment by Shaverdoff** [comment]
tcpdump -i lo port 443 -w cap
show me very strange loopback trafic...

12:14:47.121727 IP u24.36891 > u24.https: Flags [S], seq 2472812891, win 65495, options [mss 65495,sackOK,TS val 1047234320 ecr 0,nop,wscale 7], length 0
12:14:47.121735 IP u24.https > u24.36891: Flags [S.], seq 808686326, ack 2472812892, win 65483, options [mss 65495,sackOK,TS val 1047234320 ecr 1047234320,nop,wscale 7], length 0
12:14:47.121742 IP u24.36891 > u24.https: Flags [.], ack 1, win 512, options [nop,nop,TS val 1047234320 ecr 1047234320], length 0
12:14:47.121811 IP u24.36891 > u24.https: Flags [P.], seq 1:4, ack 1, win 512, options [nop,nop,TS val 1047234320 ecr 1047234320], length 3
12:14:47.121815 IP u24.https > u24.36891: Flags [.], ack 4, win 512, options [nop,nop,TS val 1047234320 ecr 1047234320], length 0
12:14:47.121833 IP u24.https > u24.36865: Flags [F.], seq 1, ack 5, win 512, options [nop,nop,TS val 1047234320 ecr 1047234314], length 0
12:14:47.121842 IP u24.36865 > u24.https: Flags [.], ack 2, win 512, options [nop,nop,TS val 1047234320 ecr 1047234320], length 0


the server communicates in a loop with itself and generates load

**Comment by Shaverdoff** [comment]
i guess i found it... after i disable mtg_exporter from config, a normal behavor was return, but also i set iptables-ddos from https://github.com/scriptzteam/anti-DDoS-iptables

**Comment by Shaverdoff** [comment]
also i found that a lot of dc telegramm was unreachable via ipv6 from host by mtg.
Validate native network connectivity
  ✅ DC 1
  ❌ DC 2: dial tcp [2001:67c:4e8:f002::a]:443: i/o timeout
  ✅ DC 3
  ✅ DC 4
  ✅ DC 5
  ❌ DC 203: dial tcp [2a0a:f280:203:a:5000::100]:443: connect: network is unreachable
set auto-update from mtg unit config, was do nothing, say that unable to connect and download dc address or some think like that
